[
  {
    "id": "FR-CATALOG-001",
    "featureId": "FEATURE-CATALOG",
    "type": "functional",
    "statement": "The catalog shall display the River atlas item.",
    "actorIds": [
      "ACTOR-VISITOR"
    ],
    "preconditions": [
      "The public entry page is available."
    ],
    "mainFlow": [
      "Open the entry page.",
      "Inspect the described state."
    ],
    "alternativeFlows": [],
    "acceptanceCriteria": [
      "Given the catalog page, River atlas is visible."
    ],
    "entityIds": [
      "ENTITY-ITEM"
    ],
    "dependsOn": [],
    "evidenceIds": [
      "EVID-9ea047ea81cbbcba"
    ],
    "status": "observed",
    "verificationState": "verified",
    "rationale": "",
    "openQuestionIds": []
  },
  {
    "id": "FR-FILTER-001",
    "featureId": "FEATURE-FILTER",
    "type": "functional",
    "statement": "Selecting Science and applying Filter shall retain River atlas.",
    "actorIds": [
      "ACTOR-VISITOR"
    ],
    "preconditions": [
      "The public entry page is available."
    ],
    "mainFlow": [
      "Select Science.",
      "Click Filter.",
      "Read results."
    ],
    "alternativeFlows": [],
    "acceptanceCriteria": [
      "Given Science selected, when Filter is clicked, River atlas — Science is displayed."
    ],
    "entityIds": [
      "ENTITY-ITEM"
    ],
    "dependsOn": [],
    "evidenceIds": [
      "EVID-8e992d4583300047",
      "EVID-cdf9f41e0c909818"
    ],
    "status": "observed",
    "verificationState": "verified",
    "rationale": "",
    "openQuestionIds": []
  },
  {
    "id": "FR-FILTER-002",
    "featureId": "FEATURE-FILTER",
    "type": "functional",
    "statement": "Selecting Art and applying Filter shall display an empty-result message.",
    "actorIds": [
      "ACTOR-VISITOR"
    ],
    "preconditions": [
      "The public entry page is available."
    ],
    "mainFlow": [
      "Select Art.",
      "Click Filter.",
      "Read empty state."
    ],
    "alternativeFlows": [],
    "acceptanceCriteria": [
      "Given Art selected, when Filter is clicked, No items found is displayed."
    ],
    "entityIds": [],
    "dependsOn": [],
    "evidenceIds": [
      "EVID-b0d9712c57e7036a",
      "EVID-415943f983727a5c"
    ],
    "status": "observed",
    "verificationState": "verified",
    "rationale": "",
    "openQuestionIds": []
  },
  {
    "id": "FR-DETAIL-001",
    "featureId": "FEATURE-DETAIL",
    "type": "functional",
    "statement": "The River atlas detail page shall display its category and format.",
    "actorIds": [
      "ACTOR-VISITOR"
    ],
    "preconditions": [
      "The public entry page is available."
    ],
    "mainFlow": [
      "Open the entry page.",
      "Inspect the described state."
    ],
    "alternativeFlows": [],
    "acceptanceCriteria": [
      "Given detail is open, Science and Book are visible."
    ],
    "entityIds": [
      "ENTITY-ITEM"
    ],
    "dependsOn": [],
    "evidenceIds": [
      "EVID-337e164078942bbe"
    ],
    "status": "observed",
    "verificationState": "verified",
    "rationale": "",
    "openQuestionIds": []
  },
  {
    "id": "FR-ACCOUNT-001",
    "featureId": "FEATURE-ACCOUNT",
    "type": "functional",
    "statement": "The public account page shall show that sign-in is required.",
    "actorIds": [
      "ACTOR-VISITOR"
    ],
    "preconditions": [
      "The public entry page is available."
    ],
    "mainFlow": [
      "Open the entry page.",
      "Inspect the described state."
    ],
    "alternativeFlows": [],
    "acceptanceCriteria": [
      "Given Account is opened, the sign-in-required message is visible."
    ],
    "entityIds": [],
    "dependsOn": [],
    "evidenceIds": [
      "EVID-ea991741f8ce8955"
    ],
    "status": "observed",
    "verificationState": "partial",
    "rationale": "",
    "openQuestionIds": [
      "QUESTION-AUTH"
    ]
  }
]
